{
  "schema_version": "m4-multipath-counterfactual-transfer.v1",
  "runtime_authority": "JSON_INTERNAL_ONLY",
  "visibility": "student_safe",
  "exact_binding": {
    "source_state_ref": {
      "tenant_id": "tenant_demo",
      "course_id": "course_demo",
      "run_id": "run_m4",
      "team_id": "team_alpha",
      "round_id": "round_1",
      "enterprise_state_id": "state_1",
      "version": 1,
      "state_digest": "aaaaaaaaaaaaaaaaaaaaaaaaaaaaaaaaaaaaaaaaaaaaaaaaaaaaaaaaaaaaaaaa"
    },
    "source_outcome_id": "outcome_1",
    "horizon_rounds": 1,
    "scenario_package_id": "scenario_m4",
    "parameter_set_id": "parameters_m4",
    "engine_id": "toy_logit_wellness_v1",
    "plugin_ids": ["plugin_wellness_stub"],
    "seed": 77
  },
  "official_path": {
    "officiality": "OFFICIAL",
    "unchanged": true,
    "outcome_id": "outcome_1",
    "opening_state_ref": {
      "tenant_id": "tenant_demo",
      "course_id": "course_demo",
      "run_id": "run_m4",
      "team_id": "team_alpha",
      "round_id": "round_0",
      "enterprise_state_id": "state_0",
      "version": 1,
      "state_digest": "bbbbbbbbbbbbbbbbbbbbbbbbbbbbbbbbbbbbbbbbbbbbbbbbbbbbbbbbbbbbbbbb"
    },
    "closing_state_ref": {
      "tenant_id": "tenant_demo",
      "course_id": "course_demo",
      "run_id": "run_m4",
      "team_id": "team_alpha",
      "round_id": "round_1",
      "enterprise_state_id": "state_1",
      "version": 1,
      "state_digest": "aaaaaaaaaaaaaaaaaaaaaaaaaaaaaaaaaaaaaaaaaaaaaaaaaaaaaaaaaaaaaaaa"
    },
    "decision_ids": ["official_decision"],
    "replay_writes_formal_results": false
  },
  "lineage": {
    "source_round_id": "round_1",
    "source_section_ids": [],
    "preserved_dissent_role_keys": ["CFO"],
    "resolution_status": "PROPOSED",
    "history_event_types": ["resolution_proposed", "DISSENT_PRESERVED"],
    "historical_decision_reentry_blocked": true
  },
  "paths": [
    {
      "path_id": "path_a",
      "label": "成本受控路径",
      "officiality": "NON_OFFICIAL",
      "decision_ids": ["decision_a"],
      "path_digest": "cccccccccccccccccccccccccccccccccccccccccccccccccccccccccccccccc",
      "mechanism_differential": {
        "changed_paths": ["cash", "capacity"],
        "changed_path_count": 2,
        "interpretation": "DETERMINISTIC_STATE_TRANSITION_DIFFERENTIAL"
      },
      "outcome_differential": {
        "baseline": "OFFICIAL_SOURCE_CLOSING_STATE",
        "cash_delta": -125,
        "capacity_delta": 10,
        "product_line_count_delta": 0,
        "operating_unit_count_delta": 0,
        "project_count_delta": 1,
        "facility_count_delta": 0,
        "terminal_state_ref": {
          "tenant_id": "tenant_demo",
          "course_id": "course_demo",
          "run_id": "run_m4",
          "team_id": "team_alpha",
          "round_id": "counterfactual_round_2",
          "enterprise_state_id": "counterfactual_state_2",
          "version": 2,
          "state_digest": "dddddddddddddddddddddddddddddddddddddddddddddddddddddddddddddddd"
        },
        "terminal_state_digest": "dddddddddddddddddddddddddddddddddddddddddddddddddddddddddddddddd"
      }
    },
    {
      "path_id": "path_b",
      "label": "扩张优先路径",
      "officiality": "NON_OFFICIAL",
      "decision_ids": ["decision_b"],
      "path_digest": "eeeeeeeeeeeeeeeeeeeeeeeeeeeeeeeeeeeeeeeeeeeeeeeeeeeeeeeeeeeeeeee",
      "mechanism_differential": {
        "changed_paths": ["cash", "capacity"],
        "changed_path_count": 2,
        "interpretation": "DETERMINISTIC_STATE_TRANSITION_DIFFERENTIAL"
      },
      "outcome_differential": {
        "baseline": "OFFICIAL_SOURCE_CLOSING_STATE",
        "cash_delta": -275,
        "capacity_delta": 10,
        "product_line_count_delta": 0,
        "operating_unit_count_delta": 0,
        "project_count_delta": 1,
        "facility_count_delta": 0,
        "terminal_state_ref": {
          "tenant_id": "tenant_demo",
          "course_id": "course_demo",
          "run_id": "run_m4",
          "team_id": "team_alpha",
          "round_id": "counterfactual_round_2b",
          "enterprise_state_id": "counterfactual_state_2b",
          "version": 2,
          "state_digest": "ffffffffffffffffffffffffffffffffffffffffffffffffffffffffffffffff"
        },
        "terminal_state_digest": "ffffffffffffffffffffffffffffffffffffffffffffffffffffffffffffffff"
      }
    }
  ],
  "teacher_debrief": {
    "available": true,
    "learning_points": ["比较机制，不改写正式结果。"],
    "apply_to_next_round": false
  },
  "student_transfer": {
    "role_safe": true,
    "visible_path_ids": ["path_a", "path_b"],
    "explanation": "正式路径仍是官方基准。",
    "excluded_fields": ["raw_counterfactual_state", "private_dissent_notes"]
  },
  "transfer": {
    "status": "READY",
    "apply_to_next_round": false,
    "source_official_state_ref": {
      "tenant_id": "tenant_demo",
      "course_id": "course_demo",
      "run_id": "run_m4",
      "team_id": "team_alpha",
      "round_id": "round_1",
      "enterprise_state_id": "state_1",
      "version": 1,
      "state_digest": "aaaaaaaaaaaaaaaaaaaaaaaaaaaaaaaaaaaaaaaaaaaaaaaaaaaaaaaaaaaaaaaa"
    }
  },
  "invariants": {
    "official_decision_writes": false,
    "official_settlement_writes": false,
    "official_state_writes": false,
    "apply_to_next_round": false,
    "replay_writes_formal_results": false
  },
  "known_limits": ["Student receives bounded role-safe differentials only."]
}
